date,title,text
2018-09-03,매매 후 누수에 대한 전주인과협의,"안녕하세요 눈팅만 하다가 골아픈 문제가 생겨서 글을 남깁니다  5월에 매매를 통해 16년된 구축 필로티2층에 들어왔습니다 전주인은 분양 후 그대로 살던 집이라 올 수리를 하고 들어왔습니다 잘 지내던 중 7월 중순부터 1층에 물이 샌다고 관리소에서 연락이 왔고 대충 눈으로 훓어보더니 이유를 모르겠다고 돌아갔습니다 이후에도 1층누수는 계속되더니 급기야 안방바닥에 물이 차기 시작했습니다 처음엔 윗층을 의심했지만, 조사? 결과 저희집 안방에 전주인이 벽걸이 에어컨을 위해 타공한 것이 드레인 관을 파손시켰고, 이 관에서 물이 세어 나오는 것이었습니다 전주인이 타공한 사실은 인정했지만, 자기들 살때는 문제없었다며 피해액 전체 보상을 못해준다고 합니다 저희집이 벽지에 친환경 페인트 도색이라 전주인에게 관 복구와 단열, 벽지+도색에 소리잠 장판과 걸레받이를 요청했는데 전주인은 관복구와 단열, 벽지와 걸레받이만 해주겠다고 합니다. 아직까지 서로 좋게좋게 말하고 있었는데 좀 난감하네요 일반적으로 과실이 있는 경우 피해액의 전체를 보상하는 걸로 알고 있는데... 법적으로 하면 시간도 오래 걸릴꺼 같고... 이럴때 보통 어떻게 하시나요?"
2018-09-03,월세전세 질문있습니다!,"안녕하세요,   어느세 지방에서 서울로 올라온지 1년정도 되어가네요..  아질게에 올렸다가 여길 추천하셔서 생각나서 한번더 질문해보게 되었습니다!   서울에서 집을구해서 살다 월세의 부담이 너무나 커서 이부분을 줄여나갈 방법을 찾고 있는데..   월세에 대해서도 좀 고민하고 그러다 전세대출까지 이르게 되었네요!   부동산? 집? 에 대해선 초년생이다보니 굉장히 무지한 수준이라 전세와 월세에 대해 문제점이나, 장단점에 대해서 알고싶습니다!   현재 저는 월세 45가량을 내고 살고 있습니다!   1. 1억~1억4천가량의 전세를 구하고싶고, 가지고 있는돈 + 전세대출로 원룸의 전세를 만약 구하게 된다면 예상 이자가 20만원 정도인데 그럼 무조건 전세대출이 이득이지 않을까요..?   2. 전세를 구할수 있는 상황 (대출등..) 이라면 월세보다 전세를 사는게 거의 무조건적으로 이득인게 맞을까요?   3. 두달가량의 월세집 계약기간이 남았는데, 전세는 언제부터 봐야할까요? 일찍구해지면 양해를 구해야하는 걸까요?   미리 감사인사 드립니다!"
2018-09-03,파주 교하 입주15년된 아파트 매매 고민되네요,"전세계약기간 만료를 앞두고 같은 단지 큰 평형 매매를 고민중입니다. 대출이 감당가능한 범위에서 발생하구요. 한참 대규모 입주를 하고있는 운정과 제2자유로를 사이에 두고 붙어있고,(그래서 제2자유로를 통한 일산,서울 접근이 나쁘지않은..) 단지가 초등학교를 품고있고, 상권이랑도 붙어있어 살기에는 그만입니다. 단 지하철이용이 불편하고 주변에 아파트단지들이 신축중인점이 걸리네요. 실거주목적이라 가격내리지만 않으면된다 쪽이긴한데 이쪽은 젬병이라 헷갈리네요. 매매결정을 내리실때 어떤기준으로 결정을 보통하시나요?"
2018-09-03,정부가 그냥 아무것도 안하고 있었어도,서울 부동산이 이 지경이 되었을까요?? 8.2 대책 안하고 임대사업자등록같은 거 알아서 하라 그러고 그냥 시장에 맡기고 집값 오른다 싶으면 공급 좀 늘리고 그랬다면 어떻게 됬을까요? 지금보다 더 올랐을까요?
2018-09-03,집을 매매하려고 합니다.(용인지역),안녕하세요  눈팅뿐이지만 항상 도움받고 있는 금비아빠입니다. 전세살이를 마감하고 매매계획을 잡고 있는터라 당원분들게 의견을 여쭙고싶습니다.   현재 판교에서 출퇴근 중이고  현재 거주지역은 용인 둔전역 부근입니다.  5살 아이가 하나 있습니다.  현재 살고 있는 곳은 5700번 버스가 있어서 출퇴근이 어려운 편은 아닙니다.(도어투도어 1시간)  예산은 무리하지 않는선에서 대출을 포함하여 2.5억입니다.  현재 고려중인 곳은 용인시청앞 행정타운오스카빌 -  2.3억 동백 백현마을 휴먼시아 - 2.6억 어정역 부근 서희삼정 - 2.3억   오스카빌의 경우 바로 앞에 삼가초등학교가 있고 용인시청 주변으로 역삼구역도시개발지구라  대단지 아파트 개발계획이 있어서 추후에 중고등학교도 크게 문제 없을것같습니다. 집앞으로 5600번 버스가 다녀서 출퇴근 시간도 문제는 없습니다. 다만 옆에 있는 두산위브의 경우 대규모 미분양이 났던 곳이라  다시 나갈때를 고려해야하기 때문에 지역적으로 문제가 있는것은 아닌가 하는 고민이 있습니다.    휴먼시아의 경우는  교육여건이나 생활환경은 이미 다 갖춰져있는 상태라서 크게 문제없습니다만 출퇴근시간이 급격히 늘어납니다. 버스만 1시간을 타야해서 고민이 생깁니다.  서희삼정의 경우도  초등학교와 중학교가 부근에 있습니다. 어정역 맞은편에 세브란스 병원이 세워질 예정입니다. 휴먼시아보다는 덜하지만 출퇴근 시간이 걱정이 됩니다.  연식은 세곳모두 12~14년 정도로 비슷합니다. 이외에 추천하시는 지역이 있으면 의견주시면 감사하겠습니다.
2018-09-03,토지보상 관련 질문이요.,서울권 그린밸트로 주택공급 후보지로 오르내리는  곳 중 한 곳에 땅을 소유중인데요. 보통 이런 땅들은 토지보상하면 보유기간에 따라 보상금과 보상자격이 달라지잖아요.   증여로 인한 소유권 이전을 하면 이것도 매매와 마찬가지로 이전등기 시점부터 보유기간을 산정하는거겠죠?
2018-09-03,가산디지털단지 신축 오피스텔 매매 합니다 (지웰이스테이트 2차),안녕하세요.. 내마당 첫글을 장터글로 시작하게 되네요;;  제 소유는 아니고.. 저희 가족이 분양받아 보유중인 지웰에스테이트 2차 오피스텔을 매매하려 합니다 가디단쪽 일하시는분이라면 익히 아실 가디단5거리 근처이고 LG전자 MC연구소 앞쪽입니다.  건물은 준공된지 얼마 안되어서 입주가 시작 했습니다. 검색해보시면 건물정보나 사진등은 많습니다  아래 지도에서 A로 표시된 위치입니다   층수는 3층이며 오피스텔 분양받았습니다. 11평으로 알고있습니다.. 사정이 있어 분양가보다 다소 싸게 판매하고자 합니다.  관심있으시거나 둘러보고싶으신분은 저한테 문자 연락 부탁드립니다. 010-2039-6287 / 이정한   감사합니다
2018-09-03,"네이버 부동산, 중복매물이 엄청나게 심하네요.....","1000세대 짜리,  강남 3구에 위치한 아파트가 있습니다.  네이버 부동산 데스크탑 버전 기준으로,  매매 물건이 80개가 올라와 있는데,   이 중 한 개는 제가 알고 있는 물건이 있습니다. 지난주 주중에 집주인을 통해 동호수 및 가격, 입주 날짜 등을 파악했고요....  오늘 네이버 부동산 들어가서 확인해 보니,  거래 완료가 대량으로 오늘 날짜로 찍혀있더군요....  무려 9개 물건이 오늘 날짜로 거래완료가 찍혀있네요.... 동호수 및 타입, 가격은 3000 차이 내외....이지만,  네이버 매물중 2~3번째로 높은 가격 이지만,  현재 시세로 보았을 때, 1억은 더 받을 수 있었을 가격이었습니다.   참 네이버 부동산, 매물 많다고 정말 믿을게 못되네요......  80개 물건 중에, 9개가 거래완료 찍혀버렸으니,   하루사이에 1000세대 아파트에서 나온 매물의 11.25%가 줄어들었네요.... 비율로 단순계산하자면 실제 매물이 8개 정도 되려나요?  제가 내린 결론은,  그 단지에 매매 물건이 엄청나게 적거나,  부동산에서 고객 끌려고 허위매물을 내놓는다던가,  아니면 매도자께서 호갱님이 되셨거나.....  주저리 써봤습니다.  p.s. 지난 주말에, 아파트 단지 바로 옆에 지하철 뚫린다고 소문났는데,  이거는 아셨나........"
2018-09-03,투자용도의 주택 구매 문의,"안녕하세요.  현재 외국에서 외국인 노동자 신분으로 살고 있는데, 현재로서는 당분간은 한국에 돌아갈 계획이 없습니다. 아마도 최소 5년에서 10년 이상 더 있을거 같은데요, 물론 그 뒤에는 한국에 돌아갈 생각입니다.  현재 월급받은거는 그냥 특별히 하는거 없이 저축 약간, 적금 약간 그리고 주식도 약간 그렇게 하고 있는데 물가 상승률만도 못한 수익같아서 개인적으로 좀 불안 합니다.  그래서 전세를 끼고 아파트를 구매 하면 어떨까 하고 고민 중입니다.  현재 상황은, 현금 등으로 약 2억 정도 그리고 경기도 광명시에 오래된 연립이 있는데 이건 곧 1동짜리 아파트 건물로 재건축 한다고 하고 기대 금액을 약 2.5억 정도 보고 있습니다. 그리고 연 순수 저축은 5천~5.5천 정도 될거 같습니다.  그리고 제가 미혼에 위의 보유한 연립 때문에 무주택도 아니라 청약은 거의 힘들다고 보고 전세를 끼고 서울 시내의 아파트를 10억 정도(+- 1억)의 금액으로 10년 상환 계획으로 구매하면 어떨까 하고 고민하고 있습니다.  매매가 10억 +- 1억 전세가 7억 +- 1억  전세가 잘 나간다는 가정하에 위의 조건으로 아파트를 구매하는게 가능하고 추천하시는지 아니면  위의 상황으로는 제가 원하는 구매하는것이 불가능하거나 비추천 하시는지 의견을 구하고자 합니다.  감사합니다."
2018-09-03,1가구 2주택자가 임대사업자 신청시 1주택자로 양도세 비과세 받을 수 있나요,"안녕하세요?  내집마련당 회원님들의 좋은 글 매번 잘 읽고 있는 조용한 회원입니다. ^^   이번에 보유 중인 아파트 중 하나를 매도하려고 하는데,   부동산에서도 좀 애매하게 보시는 부분이라 여기저기 물어보고 있는 와중에 내집마련당에도 질문글을 올려봅니다.   현재 제 상황은 2016.10에 분양 받은 아파트와 2017.03에 매수한 아파트 총 2채를 갖고 있습니다.   가격은 두 채 모두 5억 미만은 비교적 저렴한 아파트이고,  먼저 취득한 아파트를 사정상 매도하려고 하는데,  각각의 취득시기 차이(1년미만)가 얼마 안되다 보니 첫번째 취득한 아파트가 보유기간이 2년을 지났어도,  일시적 1가구 2주택 조건에 만족하지 않아서 양도세 혜택을 받지 못 하는 상황입니다.   그래서 생각해본 것이 2번째 취득한 아파트의 경우 장기보유할 생각이 있는 물건인데,   이걸 지금이라도 일반임대주택사업(4년)으로 신청하고,  임대계약을 체결한 다음에 첫번째 아파트를 올 11월 이후에 매도할 경우   양도세 비과세 혜택을 받을 수 있는 것인지 궁금합니다.   제 생각에는 임대주택의 경우 주택수에 포함되지 않기 때문에 양도세 혜택을 볼 수 있지 않을까 하는데,  회원님들은 어떻게 생각하시는지요?   아무쪼록 좋은 답변 부탁드리겠습니다.    감사합니다. ^^"
2018-09-03,주거형 오피스텔(아파텔) 상담드립니다.,"안녕하세요. 아직은 생소한듯 한데 주거형 오피스텔 매매 상담드립니다. 우선 거주 지역은 인천 송도입니다. 지난주에 핫했던 곳이지요. ㅋ 현재는 아파트 전세로 살고있으며 전세와 매매가격차이가 좀 있어 구입은 생각치 못하고 아이 키우기 좋은 환경과 출퇴근 가까워 거주 하고 있습니다. 그러다가 주거형 오피스텔이 최근 많이 생겨 문의드립니다. 거의 아파트와 동일한 평면에 가격은 2억정도 차이가 나네요. 오피스텔 평형으로는 45평(실평수 25평, 아파트 34평과 동일)이 3억 전후로 가격이 형성되어 있는데 실거주 목적으로는 괜찮지 않나 싶으면서 의구심이 드는게 너무 큰 가격차이가 있다면 분명 생각치 못한 단점이 많이 있는게 아닌가 싶어서요. 같은 평수 아파트는 5억대 입니다.  제가 확인해본 바로는 아파텔 단점으로는 비싼 취등록세(4.6%), 관리비 비쌈, 아파트 커뮤니티 사용불가 입니다. 그 외에는 아파트와 동일한데 너무 큰 가격차이를 보이네요. 아직은 시장이 불확실해서 그런것일까요? 아니면 제가 모르는 다른 문제가 있는 건지 많은 의견 부탁드립니다.  감사합니다."
2018-09-03,시스템 에어콘 질문입니다.,"안녕하세요 2020년에 입주 예정인 아파트 관련 고민이 있어서 이렇게 글을 남깁니다.  방 평수는 84제곱미터이고 방은 거실, 안방, 작은방1,작은방2, 알파룸입니다.  첫 번째 고민은 시스템 에어콘을 모든 방에 설치할 지 아니면 알파룸만 제외할지입니다. 현재 자식은 없는 상태입니다.   두 번째 고민은 에어콘에 공기청정기 옵션을 넣을지 입니다. 만약 공기 청정기 옵션을 넣을 경우 한대 당 25만원이 추가가 되며 , 만약 공기 청정기 옵션을 넣을 경우 모든 에어콘에 넣어야  한다고 합니다. 거실에만 넣어도 될 거 같긴한데... 나중에 따로 사야할지..  가격은 4대 기준으로 공기청정기 옵션 없이 650 이였던거 같습니다. "
2018-09-03,결국 질렀습니다.,현재 살고 있는 집 매도가 확정되고나니  머리는 차분히 기다리자라고 생각하지만  달리는 호랑이 등에는 타는게 아니라하지만  맘에 들었던 물건이  매도자가 다시 거둬들이고 호가 올라가는 상황을 보니  이성적 판단이 작용을 안하네요.  결국 실거주니까 제가 신고가를 갱신하더라도 살면된다고 자위하면서 질렀습니다.  ㅠㅜ 이제 영혼까지 회사에 바쳐야겠네요.
2018-09-03,서울 아파트는 비싸서 오피스텔 가계약 했습니다 ㅠㅜ,"현 등촌동 오피스텔에 살고 있는데, 여기서 애도 낳고, 교통도 편리하고, 크게 불편한점 없이 2년 전세를 살았습니다.  이제 만기가 다가와서, 발산역쪽 아파트로 이사가려 했는데,,,,같은 오피스텔에 다른 층수에 깔끔한 집이 나와서... 고민을 하다가 가계약했습니다.... 실거주 목적이지만...오피스텔이라....오르는건 바라지도 않고 떨어지지만 않으면 좋겠다는 심정으로 가계약을 했는데.... 이미 많이 오른 상태라 잘 저지른 짓인지 걱정이네요....교통 편리하고...교통편리하고....교통 편리해서....그래도 떨어지지 않겠거니 하는데.....  애도 있으니, 그렇게 정착하고 싶어지고, 추격매수라도 해야지 싶었는데...아파트는 대충 대출을 최소 2억이상을 받아야하니... 생활이 안될 듯 싶고....ㅠㅜ  여러모로 심난하네요..."
2018-09-03,송도 vs 청라...,송도 vs 청라  장기적으로 어디가 좋을까요???
2018-09-03,거참 재밌는분들 많네요.,자기랑 안맞으면 손털고 다른 놀이터 가서 열심히 놀면 되는걸...
2018-09-02,검단사거리 근방은 어떤가요?,저에겐 본가도 가깝고 방화동도 가까워서  빌라도 상관 없지만 외부소음이랑 지하주차장 때문에 아파트를 좀 보려고 합니다  아직 월세 살이 중인데 그냥 쭉 기다렸다 서울이나 경기인천에 청약을 노려야할지..  가족 집이 인천과 서울 2곳이라 새로 전입신고를 어디로 할지도 고민이네요  어차피 집 산다면 대출이겠지만 이자만큼 검단이 오를 것 같지는 않아서 푸잉..  실거주라도 이자만 너무 내면 아깝지 않습니까 ㅠㅠ  여러모로 부동산이 시끄러우니 괜히 신경 쓰이네여
2018-09-02,죽전 벽산 아파트 어떤가요??,"행정구역은 용인인데 생활권은 오리역, 동천역 가능하구요 주변에 편의 시설도 괜찮은 듯 한데  문제는 무리해서 대출하고 등등 으로 사야되는데 그럴만한 가치가 있나 고민되네요  고견 부탁 드려요!!ㅠ"
2018-09-02,8개월만에 수술대 오르는 임대사업자 혜택…임대등록자 '혼란',"김현미 국토교통부 장관이 2일 주택 임대사업자에 대한 세제 혜택을 축소하겠다고 밝힌 것과 관련해 시장에서는 찬성과 우려가 엇갈리고 있다.  ""예상치 못한 부작용을 줄이기 위해 일부 정책 수정이 불가피하다""는 반응이 있는 반면 ""정책의 일관성이 훼손돼 정책 불신만 키울 수 있다""는 우려도 나온다. 기존 임대사업 등록자들은 ""우리도 혜택이 축소되는 것이 아니냐""며 혼란에 빠졌다.  김현미 장관은 이 메시지를 시장에 직접 전달하기 위해 지난 24일 예정에 없던 긴급 오찬 간담회를 자청했다.  전문가들은 ""당·정·청이 세제 등을 고치려면 법 개정에 시간이 걸리니 연일 사전 구두개입을 통해 집값을 잡아보겠다는 다급함이 읽힌다""고 말했다.  ◇ '인센티브로 자발적 임대등록 유도→혜택 축소' 8개월 만에 정책 바꿔  김현미 장관이 지난해 12월 '음지'에 있던 주택 임대사업자 등록을 양성화하겠다며 활성화 방안을 내놓은 지 불과 8개월 만에 정책을 수정했다.  아직 구체안이 나오지 않았지만 주무 장관의 작심 발언에 비춰 임대사업자 등록자의 혜택이 종전보다 꽤 줄어들 전망이다.  문재인 정부 출범 이후 임대사업자 등록을 활성화기로 한 것은 '음지'에 있던 주택 임대사업자를 제도권으로 끌어들여 과세 대상에 포함시키고, 무주택 세입자에게는 급격한 임대료 인상 부담 없이 8년 이상 장기 거주할 수 있는 공간을 제공하자는 취지에서 출발했다.  상가 등 상업용 부동산과 달리 주택 임대사업자는 높은 임대소득을 얻으면서도 세금 한 푼 내지 않는 사각지대에 있었다.  정부는 이런 임대사업자에게 세제혜택을 줌으로써 정정당당하게 세금을 내고 임대사업을 하라고 길을 열어줬다.  (...)  출처: https://m.news.naver.com/hotissue/read.nhn?sid1=101&cid=957181&iid=3476373&oid=001&aid=0010316886"
2018-09-02,다주택자 세제 강화 하면 지금 임대사업자를 등록먼저 해야할까요,개인적 사정으로 다주택인 상황입니다만 김현미 국토부장관이 다주택 임대사업자에 대한 세제혜택을 줄이겠다는 의지를 보이고 있는데  지금 세제가 강화되기전에 임대사업자 등록하는게 나을까요 아니면 안하는게나을까요   개인적으로는 빨리 등록하는게 나을것 같은데요 고민입니다
2018-09-02,임대사업자 규제하면 추가 상승은 어려울 듯 한데요.,"다소 눈치싸움은 있겠지만, 조정 받기 전에 임사 포기하고 매물 빨리 내놓는 사람도 있을 터, 뒤늦게 팔면 손해나니까요. 급락은 아니겠지만 당분간 매물이 많아질 수도 있겠어요."
2018-09-02,이런 난리통에 서울 주택을 구입합니다만 무적 압청삼이 맞을까요,삼성에 주택을 이번에 구입합니다. (2주택입니다. 부모님사십니다. 투기아닙니다)  은퇴하시고 직접 거주하실곳이라 가격변동에 큰 폭만 없으면 되는데  사람이 간사한지고 올랏으면 합니다.  이런것 저런것 따졌을때  부모님 은퇴하고 생활 편하고 종교적 이유때문에 봉은사 옆으로 했는데  사실 기대하는게 삼성 지하도시거든요..  이런저런 전문가니 뭐니 얘기도 해보니 의견이 나뉘더군요..  중도는 아직 안갔는데 때가 때이니 만큼 어렵습니다 ㅠㅡ
2018-09-02,지방사람이 서울 아파트 청약당첨되기는 쉽지않나요,보면 당해 및 수도권에서 다 끝나버리니  아예 넣지도 못하겠던데요  지방사람도 청약 넣을수있는 단지가 있긴있나요
2018-09-02,후곡 16단지 작은집에서 큰집으로 옮기려는데,20평형에서 27평형으로 옮기려고 준비 중입니다 부동산에서는 20평형이 급매가 많으니 세를 주고 한채를 더 구입하는 방식으로 가라고 합니다 일산이야 그렇게 떨어 지지 않고 급매가 빠지면 올라갈꺼라 저도 생각이 들기는 하는데 대출을 2억 가까이 받아야 해서 부담이 되고  프리렌서 신분이라 세금부분이 걱정이 됩니다  투자보다는 내집 사서 손해는 안보자는 생각을 늘 가지고 있는데  고민이 많이 되네요  고수 분들의 조언 부탁 드립니다
2018-09-02,(본 내용 펑) 요약만 남깁니다,내용은 개인적인 부분이 있어 펑하고 간단요약 남깁니다.   1. 현 전세만기일과 새집 입주일의 텀이 1~2개월 1. 현 집주인과 계약 만료일에 나가기로 구두 협의 1. 약 2달 간 보관이사 및 단기월세를 구해야 할 듯   감사합니다.
2018-09-02,세종시 아파트 팔고 성남아파트 구입 어떨까요?,세종시 첫마을 7단지 시세가 엄청 떨어져 4억1천에서  3억2천에 매매가 되고 있습니다  성남 단대푸르지오를 구입하고 싶은데 총알이 1억5천 뿐이라 세종시집을 팔아야 가능합니다  총알이 부족한 상황에서 1주택자라 대출한도가 LTV가 60%->50%로 낮아지는 것 때문에 세종시집을 매매하고 구입해야할지 아니면 더무리해서 2채를 유지하고 천천히 세종집을 매매 할지 고민입니다... 세종시집 저 시세에 파는것.. 아까운 걸까요??
2018-09-01,집 후보군중 어느 집이 젤 괜찮아 보이시나요?,"집주인이 살고 있는 집 안판다고 해서  이사 준비중이고 집 여러개 봤는데 그나마 맘에 드는 집은 3개 뿐이네요     1번은 그냥 저냥 안쪽동이라 조용하고 무난한 층수고, 뭐 뷰도 아파트 사이로 상가 살짝 보이는 정도입니다.     2번은 뷰가 진짜 좋습니다. 그리고 줄눈 중문 되어 있어서 추가로 들어간돈이 200정도 세이브 됩니다. 근데 집에 결로가 있어요ㅠㅠ      3번은 로얄동인데... 층수가 낮고, 뷰라는게 거의 없어요. 그리고 다른데 보다 500저렴하고 집도 깨끗하고 결로도 없고 실제로 집 상태는 젤 맘에 들었습니다.  전부터 1차 앞은 공공기관 직원들 회식하는 거리고, 초등학교가 2차 뒤로 돌어올 예정이라 2차로 갈려고 했는데 2차는 매물이 거의 없어 ㅠㅠ  저 3개중 골라야 하는데 ㅠㅠ 딱 이거다 감이 안잡히네요      참 돈이 한 두푼이 아니니깐 남편이랑 둘이 계속 멍 하니 지도만 보고 있네요ㅠ"
2018-09-01,난곡동 매매는 어떨까요?,경전철들어오면 ... 이미 선반영 됬겠지만? 난곡동 빌라 전세 살고 있어요 집을 사고 싶은데... 사실 지하철 없는거 빼곤 살기좋은데요 아직은 매매하기 부담스럽지 않은 가격대인거 깉아요~ 타지역에 비해사요 그래도 무리해서라도 다른지역으로 이사를 가야할지...다른지역은 너무 비싸네요ㅠㅠ /Vollago
