date,title,text
2018-09-17,시스템 에어컨 교체해보신분들 계신가요?,안녕하세요.  오늘 관리비 고지서를 받았는데...  전기 사용량이 예상보다 많더라구요...물론 여름이라 좀 쓰긴했지만 제 생각보다..ㅠㅠ  거실과 안방에 시스템에어컨2대가 있는데 인버터가 아닌거 같아서...가능하면 요즘 제품으로 교체를 해볼까합니다.  배관은 기존 배관 이용하면 될거 같고...에어컨과 실외기만 바꾸면 될까요...?   혹 교체해보셨던 분들의 경험담 부탁드립니다. (비용 시간등...)  감사합니다
2018-09-17,'입주임박' 서울·광교 아파트 수억원 '껑충'…지방은 '울상',입주가 임박한 서울 등 수도권 아파트의 분양권 가격이 수억원씩 뛴 것으로 나타났다. 반면에 지방 아파트는 웃돈이 거의 없거나 심지어 분양가보다 떨어지는 등 양극화 현상이 뚜렷하게 나타났다.  17일 부동산 114에 따르면 다음 달 입주를 앞둔 서울 은평구 '힐스테이트 녹번'은 지난 8월 전용면적 84㎡가 8억990만원에 거래되며 2015년 분양가 5억3천990만원보다 3억원가량 올랐다. 같은 해 분양한 '광교아이파크' 전용 84㎡도 분양가 5억8천460만원 대비 평균 3억원이 넘는 웃돈이 붙어 거래된 것으로 나타났다. 현재 이 두 아파트 호가는 10억원 안팎이다. 대조적으로 지방은 웃돈은커녕 마이너스가 된 단지도 적지 않았다.  미분양 관리지역에 포함된 충남 천안 'e편한세상두정4차'는 현재 시세가 2억500만∼2억5천500만원 선으로 분양가 2억2천311만원과 비슷한 수준을 유지했다. 역시 미분양 관리지역에 포함된 충남 천안 '천안시티자이'도 분양가 수준이거나 그보다 낮은 수준에 거래되고 있다. 이처럼 지역 간 온도 차가 극명하게 나타나는 가운데 다음 달에는 전국에서 3만4천581가구가 입주한다.  (...)
2018-09-17,9.13 부동산대책 대출 관련 문의,9.13 부동산 대책 대출 관련하여 몇가지 문의 드립니다.  현재 1주택자이고 전세 놓고 전세 살고 있습니다. 그리고 보유한 아파트는 조정대상지역이고요.  1) 분양 받아 작년에 등기한 경우 이번 대출규제와 상관없는 것이 맞나요?  2) 세입자를 새로 구할 때 중간에 텀이 생기는 경우 전세퇴거자금 대출이 가능할까요?  3) 제가 실거주로 들어가는 경우 주택담보대출이 60%까지 가능한 것인가요?  아직 급한건 아닌데 그래도 미리 알아두어야 대비가 될 것 같아서요.
2018-09-17,전세vs매매..,펑합니다.
2018-09-17,대출 관련 은행 상담후기, 모 은행 창구 갔다왔습니다 . 신용 대출은 0.9억 4.5% 까지 가능할것 같다 ( 월급 이체 기준 )    주택담보대출 관련은  무주택 생애최초이므로 40%가 나올것 같으나 최근 바뀐 정부 정책에 의해 정확한 지침이 내려오지는 않아  정확히 알려주긴 힘들다 하지만 큰 변수가 없으면  40%가 나올것 같다 .   5.3억매도호가인 매물인데 현재 평가 시세는 4.85억이라 1.94억까지는 나올것 같다 .  주택담보대출은 잔금일 이전 50일부터 신청가능하다고 하더군요. 넉넉잡고 계약할때 잔금일을 2달 이후로 하면될것 같습니다   5.3억 매도호가 부른 매물은 이미 물건너갔지만  현실적으로 구매 가능여부까지 확인하니 옅게나마 안개가 걷히는 느낌입니다.  2.4억 전세 + 0.6억 현금 + 1.94억 주담대 +  0.66억 신용 구성입니다
2018-09-17,배곧신도시 어떤가요?,   분양권 p가 4000 ~ 하더라구요 
2018-09-17,유튜브 쇼킹부동산 채널 어떻게 생각하세요?,우연히 추천 동영상 목록에 떠서 보게 되었는데 제가 좀 팔랑귀라서 너무나 수긍이 되었지만 코멘트도 금지되어 있고 반대의견으로 어떤 것이 있는지 객관적인 시각을 알 수 없어서 한번 공유해봅니다. 전반적인 주제는 서울 집값은 거품이고 내년부터 빠진다는 내용입니다. 아래 동영상만 있는게 아니라 무척 많아요.
2018-09-17,GBC가 무기한 연기되었나 보네요,http://m.cnews.co.kr/m_home/view.jsp?idxno=201809170917540880098  신문기사 대로라면 이번에 연기되면 재개되는데 한세월 걸리겠네요. 삼성역 복합환승센터는 어떻게 되는건지 궁금하네요.
2018-09-17,친한 친구의 부동산 투자실력을 보니 경이롭기까지 하네요.,대학교때부터 친하게 지내던 친구가 있는데 이 친구가 옛날부터 부동산에 관심이 많았습니다. 집안은 평범했는데 본인은 억대연봉..  이 친구가 10년도에 리센츠 12평 3억6천에 샀다고 했을때 친구들이 다 미쳤다고 했죠. 그냥 오피전세로 살지 거기를 왜 사느냐고 타박할때 그 친구는 오히려 저희를 부알못이라고 놀리더군요.   근데 지금 리센츠 12평  8억이 넘었습니다. ㅠㅠ  그 이후에 한참 잠잠하다가 15년즈음 아현뉴타운쪽 34평 재개발 입주권 2개를 지상권매물로 해서 피2억 남짓 주고 사더라구요.  친구들이 자살행위라고 다 욕했습니다. 무덤에서도 대출갚을거라고 놀렸죠.  현재 두 아파트 시세가 합하면 28억이더라구요.  두 개 합쳐서 아파트분양가+프리미엄이 15억 남짓인데 (그마저도 대출로 천천히 갚으면 됨)  부모님 도움 거의 없이 본인 월급과 은행대출로  이미 40억에 가까운 자산가가 된 친구보니 처음에는 일도 하기도 싫고 밥도 안 넘어가기도 했지만 나중에는 진짜  돈은 버는 놈이 버는 거라고 느꼈습니다.  제 스스로 부동산 공부 게을리했던거 자책도 되더군요.  이 친구가 시대를 잘 만난거기도 하지만 앞으로 이런 폭등세가 다시 올지 의문스럽기도 하네요.  울적한 직장인의 점심시간전 넋두리 들어주셔서  감사합니다.
2018-09-17,방 2칸짜리는 아이 1명일때 어떤가요?.., 와이프님께서 지난 주말 보고온 방 3칸짜리 84제곱미터 집도 구축이라 설계상의 문제인지... 좁다고 하시더군요..  그런데 문제는 그 집을 사려면 현재 매도 호가 기준으로는 최소 5천만원 이상의 신용대출을 받아야합니다  저는 그래서 같은 단지 방 2개짜리는 어떠냐 물었는데.. 표정이 좋지를 않네요.. ( 방 2개짜리는 매도호가 4.2억 )   현재 아이가 3개월이고 와이프님 직장때문에 이사하는거라 최소 5년을 거주해야합니다  주담대만 1.4억정도 받는 차원에서 방 2칸짜리는 어떤가 싶네요   요약하면 84제곱미터(방3칸) 2.5억 대출 더 받느냐   58제곱미터(방2칸)가고 대출 1.4억 받느냐선택입니다..  혹시 어린아이 (5세미만) 1명과 방 2칸짜리 아파트 사시는 분들의 소중한 경험담을 듣고 싶습니다...   방 3개짜리가 매물도 안나오고 가격도 계속 높아질것 같아서    피로감때문에 매물 많은 방 2칸짜리 매매하고 끝내고 싶은 생각이드네요;
2018-09-17,여러건 대출 가능한지 궁금합니다.,(지역은 서울 광진구입니다)현재 제가 A라는 아파트에 살고 있는데 이 아파트를 팔고 B라는 다가구 주택으로 이사를 가고싶은데요. A아파트에는 현재 대출이 1억이 남아있는데 아파트 매도하면서 대출은 상환할 예정이구요. A아파트 매도가 + 5억으로 다가구를 구매하려고 합니다. (집을 옮겨서 이사갈거고 주인 세대에 제가 거주할 예정입니다. 1주택인거지요..) 헌데 B는 다가구 주택이다 보니까 LTV 40%를 땡기면 2억정도 밖에 안나옵니다. 그래서 부모님 아파트 C를 추가로 담보로 잡아 3억정도를 땡겨서 B라는 다가구 주택을 매매하고싶은데 이게 가능한지 궁금해요.
2018-09-17,9.13대책에서 이부분 이해가 안가요,이게 뭔말인지 쉽게 설명좀 부탁드려요~
2018-09-17,올해 1월 내집 마련 후기,"안녕하세요,  8달전 이야기라 조금 되었고 지금이랑 분위가가 얼마나 달라졌는지 모르겠습니다만, 혹시라도 참조가 되실까 해서 짧은 후기 올립니다.  우리집 애가 아직 어리고 저랑 와이프가 맞벌이를 하는 관계로 장모님 댁 근처 대치동에 전세 들어 살고 있습니다. 언젠가는 집을 구해야 된다는 생각을 추상적으로는 하고 있었지만, (장모님이 ""때는 지금""이라고 진지하게 조언하신) 작년 여름부터 본격적으로 실행에 옮기기 위해 움직이기 시작했습니다.  애가 대학교 들어갈때까지 실거주 목적으로 구입하는 점, 직장이 각각 판교 / 종로라는 점, 그리고 전재산 다 꼴아박는거니 최소한의 투자안정성은 있어야되는 점 고려하다보니 강남 위주로 부동산을 돌아다녔습니다.  8.2 대책 이후 조금은 시장이 소강 분위기일 줄 알았는데, 강남이어서 그런지 언제 그런 일이 있었냐는 듯, 늘 가보면 ""손님 앞에 몇팀이 대기 중입니다"", ""매물 없는데 나오게 되면 공평하게 동시에 문자로 가계약금 계좌번호를 발송합니다""는 등 강한 매도자 우위였습니다. (저는 아무리 그래도 최소한 물건을 한번 보기라도 하고 계약은 해야 하지 않나는 주의인데, 절대 그럴 상황은 아니었습니다).그런데 저희는 정책이든 시장피로 든 어쨌든 시간이 조금  분위기가 가라앉을 걸로  생각해서 일단 기다려보자로 생각했는데, 그렇게 2달 ~ 3달 시간이 지나도 가격은 깜짝 놀랄 정도로 오르기만 하고 그 동안 부동산한테 저층 / 동향 등 저희 대상범위가 아닌 물건들만 간간히 연락이 왔습니다.  안되겠다 싶어서, 11월쯤에 괜찮다고 생각한 부동산 2군데를 찍어서 주말마다 부부가 함께 찾아가는 걸로 전략을 바꾸었습니다. 그렇게 하니 좋은 점이, 인근 동급 단지의 분위기도 알려주는 등 시장 상황에 대해서 좀 더 종합적으로 설명을 해주니까 좋았고, 각 부동산이 조금씩 다른 관점에서 앞으로 나올걸로 예상되는 물건에 대한 내용 비교해서 들으니 뭔가 감이 잡히는 느낌이었습니다. 그리고 잘은 모르겠지만, 저희가 진지하게 매수의지가 있다는 걸 피력하는 효과도 있지 않았을까 생각합니다.  그러던 중 신정 지나자 마자 매물이 있다고 연락이 왔습니다. 매도인의 부모님이 돌아가셔서 나온 상속 물건이고 사실 저희 앞에 우선순위 한팀이 네고를 하고 있었는데, 상속 형제간에 어렵게 합의한 처분가격(직전 실거래가랑 같은 가격이더군요)이 있었는데 그걸 깍겠다고 협상을 하다가 천만원 차이로 Deal Break가 되어서 저희한테 기회가 왔었습니다. 집 상태를 보기라도 하고 거래하면 안되겠냐고 매도인에게 부탁해서 (부동산이 살짝 힘 써줘서) 꼼꼼하게 살펴보고 하자가 없다는 걸 확인해 그날 밤 바로 계약금을 송금했습니다. 어차피 형제간에 어렵게 합의한 가격을 바꾸는 건 현실적으로 불가능하다는 걸 전 팀이 입증했기 때문에 네고할 실익도 없고, 직전 실거래가랑 같은 가격이라면 그나마 양호하다고 판단했기 때문입니다. 물론, 장모님은 안그래도 호가에서 한푼도 안 깍고 사는 건 기본적으로 바보 짓인데, 요즘같이 정신나간 가격에 그렇게 하는 사람이 어딨냐면서 상투 잡았다고 혼 내셨지만, 저희는 돌아가는 길이 그렇게 편안할 수 없었습니다.  부동산 초보인 저희가 이번에 첫 거래를 하면서 배운 교훈은 :  1. 매도 우위 장이라도 물건이 있기는 있다. 단지 본인의 우선순위가 너무 멀어서 기회가 안오는 것이다.  2. 매도우위 장에서는 소수의 부동산을 찍어서 자주 출몰하는 것이 정력을 더 효율적으로 사용하는 방법이다.  3. 일반적인 실수요자는 대체로 당시의 꼭지에서 살 수 밖에 없다 (부동산은 거시적으로 보면 우상향하니). 그 점 자체를 두려워하면 사는 것 자체가 힘들다."
2018-09-17,현재 매도자 우위 시장이라면 최근 매수자 우위시점은 언제였나요?,주말에 친구들 만나 부동산 얘기를 하던 중  한 친구가 그러던데요  2017년 초에는 잠깐 매수자 우위시점이 있었다  부동산에서도 흔치 않는 매수자 우위시점이라고 얼른 사시라고 했다.  보면 8.2 대책 나오기 전 같아 보이는데 저는 그때 관심이 없었던지라  경험하신 분들께 여쭤보고 싶어요  최근 매수자 우위였던 시점은 언제였나요? 서울에서요
2018-09-17,국토부 생각보다 더 무능하군요.,"애들이랑 놀아주고 지쳐 쓰러졌다가 일어났더니, 잠도 안오고 해서 국토부 발표를 좀 정리해봤습니다. 아래 사진은 국토부에서 가져온 임대사업자가 등록한 ""주택수"" 입니다. 빠진 데이터는 자료가 없네요.   강남권을 따로 발표한건 4월부터인것으로 보이지만, 비율을 보면 대략 (서울의) 40%선이 아닐까 싶네요. 하여튼 빠진 데이터는 어쩔 수 없고 이와함께 임대사업자 혜택을 손봐야한다는 말을 할때 신규구매로 등록한 주택이 전국 평균은 33%정도, 강남권은 40%정도라고 말했죠.  이 숫자로 대충 계산을 해보면 서울 등록 주택수가 73,397이니까 40% 계산하면 29,358채 입니다. 다시 강남권 신규 구입해서 임사 등록한게 40% 정도 된다고 했죠? 그러니까 이걸 다시 계산하면 11,743채가 됩니다. 그러니까 임대사업자가 올 1월부터 7월까지 1.1만채를 신규 구입했다는 말이죠.  근데 말입니다. 이미지의 마지막 줄 강남거래량은 강서송,강동 소위 강남4구의 주택 거래량입니다. 이게 11,201채밖에 안되요. 완전 정확한 계산은 아니지만 (실 데이터가 없어요) 올해 강남권/서울 상승은 다주택자들이 미친듯이 집을 사들여 끌어 올린겁니다. 국토부가 내놓은 미친 임대정책때문이 말입니다.  이걸 8개월동안 그냥 구경만하고 있었다는게 믿어지지도 않고, 과연 얘들이 집값 안정화에 관심이 있기는했나하는 생각이 드네요.  P.S. 국토부 발표의 신규 구매 등록비율 33%와 40%가 언제부터인지 정확하지 않아 부정확할 수 있지만, 월별로 보면 거의 맞아요. 임대등록을 위해 싹쓸이 한겁니다."
2018-09-16,결혼을 앞둔 사람의 아파트 매매 고민 상담입니다.,"안녕하세요.  결혼을 논의하는 단계에 있는 사람입니다.  여자친구는 세들어 사는 것에 지쳤다며 지금이 집값 고점이더라도 그냥 사서 오래 살고 싶다고 하네요. 수도권에서 지하철이 뚫려 있는 곳이라면 부동산 가격이 단기적 하락을 겪더라도 언젠가 올라가긴 할 것이라고 믿고 있는지라, 오래 산다는 전제하에 저도 사는 것도 괜찮겠다고 생각하고 있습니다.  대출 풀로 땡기면 4억 초반 정도 선에서 집을 구할 수 있을 것 같아서 호갱노노로 여기저기 살펴보다가 세 군데 정도 마음에 품고 있습니다.   1. 경기광주역 앞 이편한세상 29평  이미 경강선이 있고, 이것저것 호재가 무성해서 가격에 반영되어 있는 것 같습니다. 그래도 장기적으로 보면 판교에서 일하는 사람들의 베드타운으로써 좀 더 발전할 가능성이 있다고 봅니다.   2. 평촌역 한가람신라 24평 27년차라 재건축연한 40년으로 올라가더라도 15년 버티면 재건축 노릴 수 있을 것 같습니다. 여기로 들어간다면 리모델링 하고 들어갈 생각입니다.   3. 수지구청역 수지한성 23평 24년차라 재건축까지는 오래걸릴 것 같지만 교통 편의성은 제일 좋을 것 같습니다. 역시 여기로 결정한다면 리모델링 하고 들어갈 생각입니다.   셋 다 초역세권이면서 초중고 다 근처에 있습니다. 직장 위치까지 고려한지라, 제가 알아본 선에서는 세 지역 외에 다른 곳은 고려하기 어려울 것 같기는 합니다.   꼭 매매가 아니어도 괜찮으니 제 상황이라면 어떻게 하실지 의견 부탁드리겠습니다."
2018-09-16,'34평 3억5100만원→9억원' 광주 아파트 투기장 될 판,"정부의 '9·13 부동산 대책'이 서울 등 수도권과 투기과열지구, 조정대상지역에 국한돼 있어 광주에서는 오히려 투기세력이 이번 대책을 반기는 '이상 효과'가 나타나고 있다.  부동산정책 전문가들은 광주 등 지방도시의 아파트 폭등을 안정시키기 위해서는 값이 급등한 지역의 전수 세무조사와 함께 담합 등에 대한 강력한 단속과 처벌을 병행해야 한다고 지적하고 있다.  16일 광주지역 부동산 관련 인터넷사이트 등에는 '정부의 9·13 부동산 대책에 광주는 해당되지 않는다'는 글들이 상당수 올라와 있다.  이들은 ""광주는 부동산 투자 청정지역이다. 광주 아파트값이 10억원까지 오를 수 있다""며 선동하고 있다.  실제 정부가 발표한 부동산 대책 중 종합부동산세 인상은 광주에 아무런 영향을 주지 않는다.  종부세 과표 3억원~6억원 구간을 신설했으나 광주에는 과표 3억원(공시지가 12억7000만원)에 해당하는 아파트가 거의 없다.  남구 봉선동과 광산구 수완지구, 동구 학동 일부 아파트들이 최근 들어 적게는 2억원대부터 많게는 5억원 이상 급등했으나 공시지가가 12억7000만원 이하로 책정돼 있기 때문이다.  1주택자 주택담보대출 제한도 수도권과 투기과열지구, 조정대상지역에만 한정돼 광주는 해당되지 않은 점도 투기세력들이 반기고 있다.  최근 사랑방미디어 게시판에는 3억5100만원에 분양돼 최근 9억원에 매물이 나오고 있는 봉선동 모 아파트(2016년 12월 준공·34평)의 특정 층이 반복적으로 거래 신고돼 자전거래 등 담합 의혹이 제기되고 있다.  광주는 부동산업자와 1주택자가 추가 주택담보대출을 이용해 갭투자를 하는 경우가 상당수인 것으로 알려졌다. 이들이 허위 거래로 가격을 급등시키고 담합을 조장하고 있다는 것이다.  일각에서는 정부의 고강도 부동산 규제로 인해 거품이 빠질 것을 우려한 투기세력들이 마지막 매도 타이밍을 잡고 빠지기 위해 거짓 선동을 하고 있다는 분석도 제기하고 있다. 이들의 선동에 현혹된 서민들이 일명 '상투'를 잡을 경우 막대한 금전적 손해를 볼 수 있다.  하지만 광주에 있는 투기세력에다 그동안 수도권 등 투기과열지구 부동산시장에 몰려있던 자금과 세력이 광주로 쏠릴 경우 '부동산 광풍'이 몰아칠 수 있다는 우려가 나타나고 있다.  (...)"
2018-09-16,"아래 임장 이야기가 있어서 , 팁 아닌 팁.",정말로 물건을 보고 싶으면 부부 둘이서 같이 가면 물건을 볼 확률이 아주 높아집니다.  한쪽만 가면 부동산에서도 이 매수자는 결정하는데 시간이 걸린다고 판단하거든요. 그래서 좀 성의를 덜하게 되죠.  근데 둘이서 가면 한방에 진행을 할수 있거든요..대부분 자금계획은 맞춰놓은 상태에서 찾아오는거니 거기에 바람만 잘 넣으면 계약진행이 빠르거든요..  집 구하러 다니실 분들은 같이 다니시면 좀더 많은 물건을 볼수 있을겁니다.  근데 요즘같이 매물도 적고 극도로 한쪽으로 쏠린 시장에서는 어떨지 모르겠네요.
2018-09-16,현장의 상황은 인터넷에서 보던것과 완전히 다르더군요," 지난주 토요일 실매수를 하려고 부동산업소 찾아가봤습니다 ( 임장이라고 하나요 이걸?)  인터넷에 4억초중반에 4~5개 나와있던거 전부 허위매물이었구요.     호갱노노 기준으론 마지막 4.9억이었는데...  매도호가 금액은 5.3억 1개 5.8억 1개 , 마지막 실 계약금액은 5.2억이었습니다. (아직신고안함)  5.8억에 나온물건은 중개인이 집주인이 애초에 팔 생각없는 물건이라고 얘기해주더군요..   실계약금액을 바로 등록하면 집주인들이 그가격이상으로 훨씬 높은 가격으로 팔아달라고 요구를 해서   부동산 중개인 입장에서는 높게 계약된 금액에 대한 신고가 빨리 되는 것을 좋아하지 않더라구요   집주인들의 입장은 마지막 실거래가보다는 더 높은 가격을 원한다고하고   부동산 중개인들은 집주인들이 마지막 실거래가가 얼마였는지 몰랐으면 좋겠다 는 입장이었습니다  ( 알게 되면 자꾸 가격이 올라가서 본인들이 팔기힘들다고.. )   제가 5.3억에 내일 계약하려던 물건은 집주인이 세금 예상을 잘못했다고 계약안하겠다는 의사를 보였다네요..  몇시간전에 연락받았는데 저는 이제는 아무 생각이 없네요..   물건이 나온즉시 바로 계약하지 않으면 어떻게 될지 모르는게 현재 시장 상황이더군요..  토요일에 계약했으면 매수는 못했어도 5300만원은 벌었(?)을 텐데  저는 아무것도 얻은것 없이 매수만 실패한 셈이니까요    * 5월에 4.2억에 같은 층수 같은 평형대에 실거래 됐던데.. 4개월만에 1.1억 더줘도 매물이 없으니 살수 있다는 보장이 없네요  이 페이스면 올해내에 6억찍을지도 모르겠고 저는 당연히 다른 아파트를 계약해야할것 같습니다.  열심히 시세 제공해주는 사이트 봐봤자 현장의 느낌은 다르네요... 생각한것보다 더 뜨겁습니다..  "
2018-09-16,집 계약 했습니다. 당원분들께 감사드립니다.,"최근 며칠간 집중적으로 글을 올렸습니다. https://www.clien.net/service/board/cm_havehome/12580497 CLIEN https://www.clien.net/service/board/cm_havehome/12589448 CLIEN https://www.clien.net/service/board/cm_havehome/12594828 CLIEN  내집마련당원분들께 많이 묻고 배워가며 결국 어제 집 계약 했습니다. 감사드립니다.   여러 지역중 와이프가 많이 선호하던 목동지역을 최종 결정했습니다. 1단지를 고려했지만, 안타깝게도 1억에서 2억 정도가 부족해서 구입에 실패했고, 대신 한신 청구아파트를 구매했습니다. 용적률이 높고, 옆에 열병합 발전소가 있는게 단점이지만, 학군/교통/시세를 따라 크게 뒤쳐지지 않을 가능성? 등을 보고 최종 낙점했습니다. 5~6년 후 실거주하거나, 그때 양도소득세등이 완화가 된다면 매각 후 타지역 구매등도 고려중입니다.  많은 분들이 추천해주신 광장동도 매우 매력적이었는데, 최종 결정은 와이프의 선호를 최우선했습니다. 잘한 결정이겠지요? ㅎㅎ  최근 한달간 집값 급등에 우울증이 생길 지경이어서, 진지하게 정신과 진료를 받아볼까 라는 생각까지 했습니다. 이전에 지방 근무 시작하기 전 강남의 24평형 아파트를 구매하고 내려갈지 말지를 고민한적이 있었습니다. 당시 구매/전세 갭은 1억 8천 정도였고, 이게 고민하는 몇주사이에 2억 3천까지 벌어져서 거품이라는 오판을 했습니다. 당시만 해도 금리 금방 오르고 부동산 투자가 위험하다는 뉴스가 여기저기 나오고 있을때 였는데, 지금 생각해보면 대단히 어리석은 결정이었습니다. ㅜㅜ 수주만에 오른 5천이 조금 떨어지면 사야지 하고 생각한게 지금은 그 격차가 6억이더라구요....  나중에 돈이 모이면 집을 사야지 라는 생각에 사로잡혀 괴로움에 몸부림 치다가, 와이프가 이러다 정말 우울증 약 먹어야 겠다고 그냥 최대한 빚 내서 살수 있는 집 사라고 한마디 했는데, 그말 듣고 내집마련당에 글올리고 어제 계약서 쓰는데까지 딱 5일 걸렸네요.  그 사이 무시무시한 정부 대책이  발표됐고, 추후 방향이 어디로으로 흘러가게 될지는 모르는데 너무 급하게 결정한게 아닌가 하는 불안감도 좀 있지만, 최소한 마음이 이전보다는 무척 편해졌습니다. 조정장에 일희일비하지 않고, 시장을 늘 주시힐스 있도록 할 생각입니다.   최종 계약서 쓰는데 까지 내집마련당 여러분께 많은 도움 받았습니다. 감사드립니다. 다들 편안한 주말밤 보내시길..."
