date,title,text
2018-08-19,킨텍스 GTX 부근 어떨까요?,"일산 킨텍스 gtx 역사가 정해졌고 출입구도 정해진 상태죠... 그리고 최근 급등하여  원시티의 경우 아파트 34평이 호가 9억수준입니다. 꽤 비싸죠?  그래서 눈을 돌린게 25평 아파텔입니다. 오피스텔이죠~^^ 물론 오피스텔 투자로 쉽지 않다는거 압니다. 하지만 킨텍스 아파텔은 조금 다르다고 생각이 드는데...  분양가 3억초반부터 3억중후반에 p까지하면 4억~4.5억정도입니다.  34평 아파트 8~9억에 25평 아파트라면 5.5~6억 사이 되어야 발란스가 맞는데, 아파텔 단점을 생각하더라고 좀 많이 떨어져 있다고 생각되네요.  그리고 단점인 아파텔이지만 여기 가보시면 25평 아파트 공급이 없습니다. 아파텔이 다죠. 그래서 평면도 그냥 25평 아파트입니다. 게다가 힐스테이트,더샵,원시티,꿈에그린 다 빠방하죠~^^  게다가, 주변 구축들이 30년 다 되어가다보니 신축에 대한 로망이 장난 아닙니다. 외부에서 인구유입 없어도 충분히 수요는 차고 남칠거라 봅니다.   인프라는 어떨까요? Gtx 가 아직 착공전이지만,가보신분은 아시겠지만 살기 참 좋습니다~^^   해서 아파텔이지만 한번 추천해봅니다 ㅎㅎ  내년 2월부터 꿈에그린 힐스테이트 더샵 원시티 입주하는데, 물량 부담 생각보다 적을거라 생각해봅니다.  위는 gtx 입구랑 원시티 아파텔 도면입니다."
2018-08-19,청약통장 추가 납입 궁금한게 있습니다.,현재 서울 거주중이고요. 경기도 공공아파트 분양에 관심을 가지고 있는데 50제곱 미만은 횟수로 하고 50제곱 이상은 저축액 순이라고 하는 걸 봤는데  현재 830만원 정도 들어있는데 1500만원까지 자유납입이 된다하니 1500만원 맞추고 나서 1500만원 이상에서는 납입제한이 최대 50만원이라고 하니 매월 50만원 넣으면 10달 뒤에 2000만원 되고 이게 50초과 공공아파트 넣을때 분양받을 확률이 높아지는 방법인가요? 아니면 소용 없는 짓인지요?
2018-08-19,가계약시 주의사항을 좀 알수 있을까요?,LH 신혼부부 전세임대로 신축오피스텔을 들어가려고 하는데 보존등기가 이달말이고 개별 등기는 다음달 중순이나 되야 된다고 LH는 그 후에 진행이 가능할것 같아 부동산에서 집주인이 기다려주기로 해서 내일 가계약금 100만원을 먼저 주인 계좌로 넣어주라는데 그냥 입금해줘도 문제가 없는건가요? 이런경험이 전혀 없어서 혹시나 여쭤봅니다
2018-08-19,저같은 흙수저도 가능한가요?,작년에 한국에 들어와서 어느 정도 소득이 안정되어....  살펴보니..기존 2006년도엔가 만들어놓은 청약 통장이 있어...내일 당장 돈을 납입할 생각입니다. 회차가 중요하니까 100만원을 납입한다하면 10만원씩 나눠서 내라고 하더라고요.. 이제 맞는지 궁금합니다.  또 저같이 종자돈이 없는 사람은 전세부터 시작하는 것이 맞겠지요? 최대한 전세자금 대출과 기타 대출을 끌어모아서 해야하는지.  내년초부터 살 집이 필요한데 답답한 마음에 몇자 적어 봅니다.
2018-08-19,가을 분양대전 예고…전국 8만6000가구 분양,"여름 휴가도 슬슬 마무리 되면서 주택 분양시장도 가을 성수기를 준비하고 있다. 8월 중순으로 접어들면서 절기상 가을로 접어든 올해 분양시장은 지난해 같은 기간보다 물량이 크게 증가했다.  19일 부동산인포에 따르면 올 가을(8월~10월) 전국에서는 총 8만6648가구(아파트 기준·민간임대 포함)가 분양을 준비 중인 것으로 조사 됐다. 이는 지난해 같은 기간(4만7258가구) 대비 83.4% 증가한 수준이다.  월별로는 역대급 무더위를 기록 중인 8월 분양은 줄어드는 반면, 9월과 10월 분양물량이 급증한다.  권역별 물량 가운데 증가폭이 가장 큰 곳은 지방도시로 지난해 같은 기간(1만2700가구) 대비 93.1%가 증가한 총 2만4522가구가 계획됐다. 이어 수도권이 88.1% 증가한 4만6463가구가 분양할 계획이다.  권일 부동산인포 리서치팀장은 “곳곳에서 미분양 증가소식이 들리기도 하지만 서울이나 지방 일부 지역들에서는 수만명의 1순위자들이 청약통장을 꺼내 들면서 높은 경쟁률이 속출하고 있다”면서 “규제에도 불구하고 시중 부동자금이 흘러갈 곳이 마땅치 않은데다 이제 막 입주를 하거나 입주예정인 아파트 분양권 대부분이 적잖은 프리미엄이 붙어 있기 때문으로 관심지역, 아파트에 대한 청약자의 쏠림은 가을에도 이어질 전망이다”고 말했다. (...)"
2018-08-19,보류지 입찰 해본 분 계신가요?,최근 보류지에 관심이 생겼는데 정보찾기가 힘드네요.  입찰을 할때 적어서 내고 그중에 최고가액이 낙찰되는건지 영화에서 보듯 손들고 값을 부르는건지 ^^
2018-08-19,강북에 경전철 기사가 떳내요,이건 노선주변 주민들한테는 호재인건가요? 지하철이 아닌데 경전철은 어떤 건지 감이 안오네요 지상열차인지 지하열차인지도 갸웃 합니다?   http://m.yna.co.kr/kr/contents/?cid=AKR20180819023700004&mobile /Vollago
2018-08-19,입주 기간 많이 남은 집 매매시 중도금? 전세?,안녕하세요. DrTanzania 입니다.  집주인이 살고 있고 내년 2월에 비울 집을 8월에 제가 매수하려고 합니다.  이런 경우 계약과 입주 사이 시간이 많아 계약금을 주고 중간에 중도금을 제가 한 번 줘야지 생각했는데요..  부동산에서는 지금 일부 금액을 주고 명의를 제 앞으로 돌리고 집주인이 단기 전세를 사는 식으로 처리하자고 하네요.  전 올해 1주택을 유지하는게 유리하고 매매+전세 계약을 하면 복비도 두 번 나가고 원래 집주인의 경우 전세 설정도 해야 하는 것 같은데  이런 매매+전세를 권하는 다른 이유가 있을까요? 이런 식이 저한테 유리한 부분이 있는지 궁금합니다.
2018-08-19,"12억 예산, 잠실 용산 흑석 과천 질문이요","저번에 관악동작 질문했었는데요,  신대방이던 동작이던 어차피 한번은 옮겨야 할 것 같아서  주담대 받고 영혼을 끌어모으면 12억까지는 모을 수 있을것같아 리스트를 수정했습니다  학군은 성인들만 살아서 필요없고  (중요)낙성대에서 자차로 최대한 가까웠으면 합니다  기준은 24평이고, 평수가 다른것들은 옆에 괄호로 표시했어요   1. 이촌동 요즘 용산이 핫해서 내집마련당에서도 용산 들어가라고 조언 많이 해주시더라구요 단점: 20년 넘어가는 아파트에 복도식이 대부분이고, 계단식도 구조가 이상하네요  2. 파크리오 라인에 따라 2호선은 한강(?), 8호선은 올림픽공원 조망이 가능하기도 하고 둘다 환승으로 9호선 쓸 수 있어요 단점: 진주미성크로바 들어오고 잠5 재건축 할 생각하면 시세가 어찌될지 가늠이 안되네요  3. 신천동 주상복합(40-50) 얼마전에 내집마련당에 올라온 글 봤는데, 뷰가 엄청나더라구요. 그리고 장미가 아무리 높게 올라온다고 해도 한강뷰가 완전히 가리지는 않을것같구요 단점: 가지고 있는걸 하나 팔아야해요, 와이프가 높은층 싫어합니다  4. 헬리오시티 거의 10,000세대에 24평은 다 판상형이더라구요 단점: 잠실에 비해 살짝 아쉬운 입지, 여기는 둔촌주공때문에 파크리오처럼 시세예측이 잘 안되네요  5. 과천주공 조합원(34) 34평 선택하면 추가분담금까지 총 12억 드네요 처음부터 하드하게 대출이자내는 다른곳 대비 돈을 좀 천천히 조달해도 돼요 단점: 언제 재건축될지 모르겠어요  6. 아크로리버하임 한강이 보이긴 해요, 그리고 대림건설 자체를 선호하기도 하고 9호선 초역세권은 괜찮아 보입니다 단점: 한강현대, 명수대현대 재건축 전까지는 흑석동 대장일것같은데 흑석에 12.5억이라... 와이프가 좀 그렇다네요...  7. 래미안트윈파크(33) 본동 자체 입지를 좋게 생각하는데다 거실에서 한강도 보이고, 9호선에 노들섬 생각하면 호재도 충분하다 보여집니다 단점: 동네 상업시설이 아쉬워요(대형마트를 용산으로 간대요), 아파트만 좋다는 느낌이 있어요  어디가 나을까요?"
2018-08-19,아파트 분양 관련된 책이 있을까요?,"안녕하세요. 서울거주하는 30대 초 입니다.  혹시 아파트 분양과 관련되어 A-Z까지 설명된 책이 있을까요?  용어 라든지, 절차나 대출이나 이런것들이 현재 최신버전이 아니더라도 큰 흐름은 비슷할거라 생각 되는데,  그 개괄적인 내용을 습득하기 좋은 책이 있을까요?  이쪽은 전혀 몰라서요. 입문서처럼.."
2018-08-19,흑석동 vs 우면동 vs 과천 vs 용산,제가 매입을 원하는 지역과 아파트입니다.  전세끼고 투자를 해볼까 하는데요 어디가 좋을지 조심스럽네요~  1.명수대 현대 가 재건축이 힘들꺼라는 말도 있긴 하던대 좁긴 한데 그래도 한강변이라 명수대 현대 아파트  2.우면동 네이쳐힐 서초힐 이런데가 지하철이 없긴한데 서초구이고 괘적한 환경 이라고 생각이 들어서요  3.과천 8단지 재건축 or 입주시작한 래미안센트럴스위트  4.용산 한가람 아파트 or 마포쪽에 있는 리버힐삼성아파트나 강변삼성스위트  매매가로 치면 다 10억이상하고 전세 5억 -6억 정도 하고 있는듯 한데 앞으로 어디가 입지적으로 어떨까요?   두루두루 잘아시는 분들 견해좀 부탁드려요~
2018-08-19,전세집 가계약금 관련 도움 구합니다 ㅠㅠ,"안녕하세요, 전세집 가계약금 관련하여 문제가 생겨 회원님들의 도움을 청합니다. 워낙에 이런쪽으로는 지식도 없고 해서 질문드릴곳이 이곳밖에 없네요. 먼저 감사하고 죄송합니다.  최근 저와 친 형님 두 명이 살 집을 구하는 도중 저는 요즘 일이 바빠 형님에게 집구하는 일을 일임해서 진행하고 있었는데요 지난 금요일에 형님이 괜찮은 집을 구했다고 하고 바로 가계약금 100만원을 집주인 계좌로 입금해달라고 하더군요. 부동산에서는 가계약 내용 문자도 보내왔구요.  일단 괜찮다고 해서 입금한후 어제 토요일 그 집을 가보니 제가 판단하기에 남자 두명이 살집은 아니란 생각이 들어 부동산에 이야기해서 취소하려고하니 그러면 가계약금 100만원은 못받는다고 형님이 그러더라구요.   요즘 상황이 너무 않좋아서 100만원도 저에게는 큰 돈인데 못받는게 너무 억울하기도 하고 해서 혹시 관련 경험이나 지식이 있으시면 도움을 좀 청해봅니다.  가계약 문자 내용 중에 전세자금대출이 불가시 가계약금을 돌려주는 조건이라고 명시는 되어있는데 제가 만약 은행에 가서 전세자금신청이 안되었다고 이야기하면 부동산에서 믿어줄까요? 아니면 관련 서류가 필요한가요?  고견 부탁드립니다. ㅠㅠ"
2018-08-19,아파트 매매 고민상담 드립니다.,"집 선택 도움 부탁 드립니다. 현재 가용한 자금은 지금사는 전세 보증금 4억 + 신용대출 1.5억 수준입니다.  산성역 포레스티아 조합원매물 (33평기준 8~9억/이주비지원 제외하면 초기투자금 5억 수준, 2020년 7월 입주) vs 과천 래미안 슈르(2008년식) 매매(전세끼고 매매 예정/33평기준 매매가 10.5억/전세시세 6.5억)  10년정도 뒤를 바라봤을때 어디가 더 나은 선택이 될지 고민입니다. 두군데 모두 어느정도 호재성 뉴스가 있는 곳들이라서요.. (산성:판교역 8호선 연장/과천:gtx c노선 등등..)  산성의 경우 대출을 추가로 받아야하는 부담과 지금도 이미 분양가대비 2배정도 오른상태인데 추가 상승 여력이 있을지.. 과천의 경우 1기재건축 단지라 지식정보타운과 2기 재건축 아파트들이 완공시 같이 동반상승할지, 또는 구축 아파트가되어 가격이 떨어질지..  고민이되어 쉽사리 결정을 못하고 있네요. 고견 부탁 드립니다.  감사합니다."
2018-08-19,대출받아 투자하는게 좋을까요?,"최근 결혼하여 송파에서 신혼생활을 시작한 30대 중반입니다.  결혼 당시에는 당장 결혼자금을 마련하느라 급해 투자에 대해 생각을 못했고, 이제 조금씩 부동산에 대해 알아보고 있습니다  현재 집은 전세이고, 대출이 1억정도 있습니다. 직장은 수원과 양재로 둘 다 세후 6-7000 정도의 연봉을 다는 직장인입니다.  현재 두가지 안을 생각중입니다.  첫째, 마.용.성 중 그나마(?) 저평가 되었다고 생각하는 곳에 전세를 끼고 25평형을 매매하려고 합니다. 물론 대출을 받아야 합니다. 이럴 경우, 직장과 거리가 있어 실거주는 현재 사는곳에 살고 투자목적으로 하려고 생각중입니다. 이때 궁금한점은 대출로 매매한집은 전세가 잘 안나간다던데 이런 인기지역의 상황이 실제로도 그런지 궁금합니다.  둘째, 용인, 분당 라인에 매매를 하려고 합니다. 아무래도 서로 직장간 중간 지점이다 보니 실거주 목적으로 32평 이상의 집을 매매하려고 합니다.  우문현답을 바라는것 같지만, 많은 신혼부부가 같은 고민을 하고 있을 것 같네요, 선배님들의 조언 부탁드립니다."
2018-08-19,포장이사 팁좀 부탁드립니다.,안녕하세요. 포장이사를 하려고 하는데.. 처음 이라 대략 뭐가 뭔지 잘 모르겠습니다 ;  에누리 가니까 비교 견적을 내주더라구요.. 15층 25평이고 10층 33평으로 서울내 이동을 하는데  양쪽다 사다리는 필수 인가요??? 평균적인 포장이사 비용은 얼마나 될까요?  고급형과 일반형으로 나뉘어져있는데.. 일방형과 고급형이 많이 차이날까요??  일반형에 추가금 더드리고 잘해달라고 요청하는게 나을까요??  고수님들 조언부탁드립니다.
2018-08-19,오래된 제 첫 집 이야기..,"결혼 15주년이 된 40초중반 아재입니다.  대학때 부모님이 지원해주신 원룸보증금에 저랑 아내가 가지고 있던 돈 탈탈 털어서 1억 4천으로 시작했습니다.  회사 가까운 마포에 전세를 얻어서 시작했는데 6개월도 안 돼서 갑자기 집을 막 사고 싶어졌습니다.  여기저기 알아보다가 생전 듣도보도 못한 동네(저희 부부가 둘 다 지방출신이라)인 잠원동에 25평 재건축아파트 첫 집을 사게 됩니다.  부동산뱅크 들어가서 서울지도 보면서 이 동네 저 동네 매물 구경하다가 최종적으로 잠실 진주아파트랑 잠원동 한신**차를 최종후보로 놓고 고민하다 잠원동으로 정합니다.(촌놈 주제에 부동산에 대한 안목은 있었나봅니다)  매매가 4억에 부대비용과 인테리어비용 4천 더해서 4억 4천이 들었습니다.  3억이 부족했는데 조흥은행에서 2억대출받고 회사임직원대출 6천에 마이너스 4천을 받았던 기억이 나네요.  2004년 4월에 집을 사고 이 집이 2005년부터 급등하기 시작합니다. 급기야 2006년 말에는 실거래가 8억을 찍더군요. 그리고는 2007년 1월을 정점으로 하락하기 시작합니다.(강남은 좀 빨리 꺾였구요 다른 지역은 계속 타오르다가 리먼때 확 꺾입니다.)  집 사고 얼마 후 아기가 생기면서 좁은 복도식 25평을 벗어나고 싶다는 생각에 30평대를 알아보기 시작합니다.  이 때 저의 관심은 제 집값이 아니라 35평과의 스프레드였습니다. 살아보니 잠원동이 너무 좋아서 다른 동네는 알아보지도 않고 오직 동네서 갈아타기만 생각했습니다.  2007년 여름 예상보다 빨리 급매가 나오기 시작하고 비과세요건도 채우면서 30평대를 보러 다니기 시작했습니다.   이때 마지막까지 남은 후보가 한신5차(현 아크로리버뷰), 한신6차(현 신센자), 제가 산 한신**차(재건축 추진중)였습니다.  그때 저 아파트들이 다 8억대였네요.(지금은...)  사고파는 추가비용을 1.5억 언더를 목표로 해서 거래하던 부동산 사장님께 알아서 가격 맞춰 달라고 했고, 얼마후 사고팔고를 동시에 진행했습니다.  8.3억에 급매나온 걸 사고 제 집은 연초대비 1억빠진 7억에 과감하게 매도.. 그때나 지금이나 모든 거래는 목표가에 근접하면 아쉬워하지 않고 던집니다.  결국 제 자본 1.4억을 가지고 4억짜리 사서 3년만에 7억에 팔았으니 첫 부동산 투자치고는 썩 괜찮은 결과였던 것 같습니다.  참고로 제가 판 25평은 아직 재건축 추진중이고 현 실거래가는 17-18억정도 하네요.  다음에 기회되면 두번째 세번째 집 사고 판 얘기도 한번 써 보려고 합니다.  (첫 집에서는 대박났지만 그 뒤로는 한참동안 삽질을 합니다ㅎㅎ 잠원동을 버리고 딴 데로 가는 바람에ㅜㅜ)"
2018-08-19,2년전 집샀던 이야기,"2년전 내집마련당분들의 도움으로 집을 샀었는데   지금 상황이랑 비슷하네요.   16년 초반 정부의 정책발표 이후 (대출 규제?) 급 시세 상승하여 1년만에 약 20%, 1억이 올랐죠.   아 저축 월 200씩 해봐야 소용 없구나, 대출풀로 무조건 서울에 사야겠다고 맘먹고 목동/용산/공덕을 열심히 알아보다   공덕역 근처 2000년 초반에 지은 25평을 그당시 최고가인 6억에 매입을 했네요. (직장이 여의도라 공덕으로 정했는데 지금보니 이촌동 갈껄)   그때만 해도 와이프의 반대에 부딪혔는데,   1. 너무 올라 떨어질거 같다는 느낌적인 느낌 2. 지금 30평대 사는데 작은데 가야하냐? (행신 전세) 3. 대출 그렇게 땡기면 원리금 갚을수 있느냐 (3억 정도)   였는데, 그때 제 답변은   1. 역세권 소형은 최대한 방어가 된다 2. 당연히 서울 가면 작은데 가야한다 30평대 나름 새아파트 갈려면 네가 좀 보태라 (외벌이임다 ㅠㅠ) 3. 작년에 월 200씩 저축했다. 월리금 월 160은 껌이다.   마지막으로 난 죽어도 서울서 죽을테니 그리 알아라. 내가 가장이니 내 결정에 따르기 싫다면 이혼하자(진짜로 좀 심각했어요)   와이프나 저나 지방 출신이지만 저희 아버지는 AID 차관 아파트 파시고 평생 후회를하고 계셔서 전 무조건 서울에 집을 마련해야 은퇴시점에 유동화할 자산이 있다는 주의였거든요. 와이픈 무리하지 말고 현 수준에서 여유있게 살자였어요.   2년이 흐르고 나니, 그때 보다 약 3억 올랐네요   요즘 와이프왈   그때 더 좋은 입지의 30평대 왜 안샀냐고 하네요. (아 진짜, 예산맞춰 겨우 샀더니)   암튼 드리고 싶은 얘기는 자랑이 아니고, 실거주는 내가 감당할 수 있고 역세권 직주근접한 나름 새아파트(지하에 주차장 연결되는)는 매우 긍정적으로 접근하시면 좋을 것 같습니다.   실제 팔기전까지 등락이 있어도 내 원리금에 영향은 전혀 없고, 단기 하락은 있어도 화폐가치는 하락하기 때문에 부동산 가격은 장기 우상향 할 수 밖에 없거든요.   저도 직장생활 한 10년 넘어 집을 사고 나니, 조금 일찍 샀었더라면 하는 후회가 있더라고요.   아무쪼록 저처럼 독단적인 결정은 마시고 잘 상의하셔서 좋은 의사결정 하시길 바랍니다."
2018-08-19,동탄2는 어떻게 될까요??,"서울과의 물리적 거리로 볼때 서울생활권을 가진 분들은 들어가기 힘들것 같고.. 그위에 분당 광교 판교 대장들이 버티고 있고,  (지금도 위 지역에 못들어가는 사람들의 대체 지역으로 굳어지는 모습인데요,   대부분 이런경우 상승시에도 위에 지역보단 더 낮게 오르고 하락시엔 더 많이 떨어지는 경향을 봐서요) 또한 동탄2에 물량도 어마무시하고..  그 주변이나 아래에는 쏟아지는 용인 오산 평택 물량이 많아서.. 개인적으로는 더 이상 오르기 힘들고 투자 가치로는 이미 꼭지를 찍은것 같은데..  동탄2에 투자하긴 좀 위험부담이 많은것 같아서 고민입니다.. 거품이 많은 동네라고 저는 생각이 들어서요.. (그래서 제가 생각이 짧아서 돈을 못버나..생각도 들구요..) 다른 고수분들의 솔직한 생각을 여쭤보고 싶습니다.. (서울엔 투자하기엔 제 총알이 너무 부족하네요)"
2018-08-19,양도세 문의드립니다,잠실 재건축 대상 소형아파트 전세끼고 구매 고민중입니다 집이 오래되고 평수가 작아서 실거주는 못할거 같습니다 재건축이 길어지거나 목표 금액에 접근한다면 다시 팔수도 있을거 같습니다 장기보유 특별공제에 실거주 조건이 추가되었는데 3년 이상 보유하였으나 전세주고 실제 거주한적이 없다면 장기보유 특별공제(24%)는 받지 못하고 9억원 초과분에 대해 38%? 40? 양도세를 다 내게 되는건가요? 아니면 9억 초과분이 아닌 집값 총액을 기준으로 차액에 대해서 양도세를 내는건가요?
2018-08-19,인테리어 관련 문의,안녕하세요.  이번에 매매로 용인시 기흥구에 아파트 이사들어갑니다. 인생 첫 집이라 설레이면서도 참 신경 쓸일이 많아서 힘드네요ㅠㅠ 16년 된 아파트라서 올 수리 해서 들어갈 생각인데 현재 주인세대가 살고 있습니다. 그럼 인테리어 견적을 어떻게 봐야될까요? 인테리어 업체 한곳만 견적 볼것이 아니라서 여러번 봐야될 것 같은데 집주인에게 양해를 구하고 매번 볼 수밖에 없을까요? 이런 경우가 첨이다 보니 양해를 구하는게 맞는건지 잘 모르겟습니다.   혹시 경험 있으신분들 조언 부탁드립니다.  감사합니다. 
2018-08-19,2억 갭투자 조언부탁합니다.,갭투자 후 임대사업자로 등록하고 8년 묵혀둘 예정입니다.   어제 방화역을 다녀왔는데 5단지는 22평형이 4.3으로 올라버렸고 갭도 1.7까지 벌어졌습니다.  4단지 괜찮은 매물을 발견하고  계약금 넣을려고 하는데 집주인 갑자기 3천만원을 올려버려서 성사되지못했네요.   오래묵혀둘 예정이라 지금보다는 미래가치를 보고 안정적으로 투자하고 싶은데 좋은 동네 있으면 소개부탁드립니다.   감사합니다~
2018-08-19,고양시 일산 어떻게 될까요?,"일산 오를까요?  20년정도되는 아파트들 엄청 많은데, 거래도 꾸준히 되는것 같긴 한데, 교통여건 개발도 슬금슬금, 뭔가 계속 들어오기도 하구요.  상가는 노답인거같고 주택은 부분적으로 인기있는 동네(킨텍스 주변 새 단지들)도 있는데 ... 전반적으로는 상당히 잠잠하네요."
2018-08-19,용인 기흥 아이유쉘 매매,안녕하세요. 3억 언더로 아파트 매매 알아보고 있습니다. 용인 기흥 아이유쉘 신축아파트 실거주용으로 구매 생각하고 있는데  판교까지 출퇴근 하기에는 어떤가요?
